Name,Organization,ProjectCodeChamp_SS,International Catrobat Association,"Through Catrobat, we want to enable teenagers to learn how to code and how to create their own games, animations, and other apps, directly on their phones."
Sanket Shevkar,Accord Project,Linux Foundation’s open source project for smart legal contracts.
Niki Ito,Processing Foundation,The Processing Foundation’s mission is to promote software literacy and visual literacy — and to make these fields accessible to diverse communities.
BHAVESH SHARMA,LibreHealth,"LibreHealth is collaborative community for free & open source software projects in Health IT, and is a member project of Software Freedom Conservancy."
Utsav Akhaury,gprMax,"Numerical modelling software for simulating electromagnetic wave propagation, and the most widely-used tool for simulating Ground Penetrating Radar (GPR)."
Balaje,NumFOCUS,"NumFOCUS supports and promotes world-class, innovative, open source scientific software."
Bartłomiej Rasztabiga,OpenMRS,The OpenMRS community globally works together to build the world's leading open-source enterprise electronic medical record system platform.
Jatin Sharma,TensorFlow,TensorFlow is an open-source machine learning framework for everyone.
Ainhoa Maestro,Liquid Galaxy project,Liquid Galaxy is a panoramic system that runs Google Earth across a PC cluster
Aryaman Gupta,Oppia Foundation,"Oppia is a free online learning platform that makes quality education accessible for all. The website is built with Angular 2+ and Python, and we also have an Android application."
Micah Kendall,LabLua,"LabLua is a research lab dedicated to research on programming languages, with emphasis on the Lua language and reactive programming."
July541,Haskell.org,"Haskell is an advanced, purely functional programming language. It boasts a strong type system with type inference. It compiles to fast native code with a concurrent runtime."
Kumar Saurabh Raj,Sugar Labs,"We make tools that learners use to explore, discover, create, and
reflect. We encourage our users to appropriate them, taking ownership
and responsibility for their learning."
Shridhar Goel,AnkiDroid,"Study all sorts of things wherever and whenever you want. Make good use of idle times on bus trips, in supermarket queues or any other waiting situation!"
Donald Lee,FRRouting,"FRRouting (FRR) is a routing protocol suite for *nix platforms including protocol daemons for BGP, IS-IS, LDP, OSPF, PIM, PBR, RIP, BFD, Babel, OpenFabric, VRRP, EIGRP, and NHRP."
Shriyanshu Kukreti,International Catrobat Association,"Through Catrobat, we want to enable teenagers to learn how to code and how to create their own games, animations, and other apps, directly on their phones."
GUIFO FODJO A Yvan,Pharo Consortium,"Pharo is a pure object-oriented programming language and a powerful environment, focused on simplicity and immediate feedback (think IDE and OS rolled into one)."
Metehan Arslan,VideoLAN,The VideoLAN project is led by and composed of a team of volunteers who believe in the power of open source to rock the multimedia world.
Akshit,The ns-3 Network Simulator Project,ns-3 is a simulation tool for performance evaluation of computer networks and protocols.  ns-3 users build models and scenarios of networks to conduct simulation experiments.
Daniil Ignatiev,Apertium,A free/open-source machine translation platform.
Hồng Quân Trần,The Apache Software Foundation,Providing open source software to the public free of charge
Roshan Swain,mlpack,"mlpack is a fast, flexible machine learning library written in C++."
Hang Yan,Point Cloud Library,"The Point Cloud Library (PCL) is a standalone, large scale, open project for 2D/3D image and point cloud processing."
Manorit Chawdhry,The Honeynet Project,The Honeynet Project is a non-profit research organization dedicated to improving the security of the Internet at no cost to the public. Focus is on honeypots and threat analysis.
Daniel Swanson,Apertium,A free/open-source machine translation platform.
moki1202,PEcAn Project,"Ecosystem science, policy, and management informed by the best data and models"
btut,JabRef e.V.,JabRef is one of the most widely used open-source citation and reference management tools. It helps students and researchers to organize their literature.
Katie Liu,Processing Foundation,The Processing Foundation’s mission is to promote software literacy and visual literacy — and to make these fields accessible to diverse communities.
Pranav Ballaney,National Resource for Network Biology (NRNB),"The National Resource for Network Biology (NRNB) organizes the development of free, open source software to enable network-based visualization, analysis, and biomedical discovery."
Geraldine Galindo,Pharo Consortium,"Pharo is a pure object-oriented programming language and a powerful environment, focused on simplicity and immediate feedback (think IDE and OS rolled into one)."
Anubhab Das,CERN-HSF,"CERN-HEP Software Foundation, the umbrella organization for particle physics in GSoC"
Shyam,SCoRe Lab,SCoRe Lab is a research lab that seeks sustainable solutions for various problems in developing countries.
Adam Leung,VideoLAN,The VideoLAN project is led by and composed of a team of volunteers who believe in the power of open source to rock the multimedia world.
Fahad Israr,JBoss Community,JBoss Community is a community of open source projects around JBoss middleware
Cyrine Gamoudi,GitLab,GitLab is a complete DevOps platform delivered as a single application. This makes GitLab unique and creates a streamlined software workflow for your organization.
Apoorva Agarwal-1,Cuneiform Digital Library Initiative (CDLI),"CDLI is driven by the mission to enable collection, preservation, and accessibility of information concerning artifacts inscribed the cuneiform script."
Manuel Genovés,GNOME Foundation,GNOME is the most popular Linux Free/Libre desktop environment with cutting edge apps. Together we are a diverse and friendly community who support each other in reaching our goal.
Ming Liang Ang,TensorFlow,TensorFlow is an open-source machine learning framework for everyone.
orion cohen,MDAnalysis,MDAnalysis is a widely used Python library for the analysis of computer simulations of molecules  — from proteins to novel materials. It is written by scientists for scientists.
Yurii Halychanskyi,Machine Learning for Science (ML4SCI) Umbrella Organization,Umbrella organization for machine learning applications to open problems in science
Rohitesh Jain,CASTOR,CASTOR develops software technology for the development and management of trustworthy software intensive systems for critical functions.
FromG,International Catrobat Association,"Through Catrobat, we want to enable teenagers to learn how to code and how to create their own games, animations, and other apps, directly on their phones."
Joshua Nsereko,OpenMRS,The OpenMRS community globally works together to build the world's leading open-source enterprise electronic medical record system platform.
Shantanu Kaushik,Processing Foundation,The Processing Foundation’s mission is to promote software literacy and visual literacy — and to make these fields accessible to diverse communities.
Sachin Jindal,KDE Community,"The KDE community produces Free and Open Source Software and brings together artists, designers, programmers, translators, users, writers and other contributors from everywhere"
Pau Riera i Portillo,NumFOCUS,"NumFOCUS supports and promotes world-class, innovative, open source scientific software."
Vinayak Sharma,Python Software Foundation,"Python is a popular high-level programming language used by scientists, developers, and
many others who want to work more quickly and integrate systems more effectively."
Masood Kamandy,Processing Foundation,The Processing Foundation’s mission is to promote software literacy and visual literacy — and to make these fields accessible to diverse communities.
Joykirat Singh,Sugar Labs,"We make tools that learners use to explore, discover, create, and
reflect. We encourage our users to appropriate them, taking ownership
and responsibility for their learning."
Kira Patton,Debian,"Debian is a free operating system (OS). It provides more than an OS, coming with over 51,000 software packages bundled in a nice format for easy installation on your machine."
Javed Ali,National Resource for Network Biology (NRNB),"The National Resource for Network Biology (NRNB) organizes the development of free, open source software to enable network-based visualization, analysis, and biomedical discovery."
Nishant Mittal,Joplin,"Joplin is an open-source note taking and to-do application with synchronisation capabilities. The notes are searchable, tagged and images or files can be attached to them."
Samarpan Dutta,Casbin,"Authorization library that supports access control models like ACL, RBAC, ABAC"
Thanoshan M.V.,The Apache Software Foundation,Providing open source software to the public free of charge
Anirban Chetia,The R Project for Statistical Computing,"R provides a wide variety of statistical and graphical techniques, and is highly extensible. R is often the tool of choice for research in statistical methodology."
Pulkit Midha,MediaPipe,"MediaPipe offers open source cross-platform, customizable ML solutions for live and streaming media."
Rohit Topi,CERN-HSF,"CERN-HEP Software Foundation, the umbrella organization for particle physics in GSoC"
Ayush Prasad,PEcAn Project,"Ecosystem science, policy, and management informed by the best data and models"
Shivam Agarwal,Chromium,"Chromium is an open-source project that aims to provide fast, seamless, safe, and reliable computing experiences for all."
Callum Brown,Matrix.org,"An open network for secure, decentralized communication"
Sanchit (pilgrim2308),coala,"coala provides a command-line interface for linting and fixing all your code, regardless of the programming languages you use with just one tool and just one configuration file."
ranjit shah,Digital Impact Alliance (DIAL) at UN Foundation,"Open source projects for humanitarian work, international development, and peace"
anuejn,apertus° Association,apertus° is developing free and open technology for professional film production.
Veronia Iskandar,Free and Open Source Silicon Foundation,Working together to improve the Free and Open Source Silicon ecosystem
Utkarsh Shendge,The Palisadoes Foundation,"Our software projects help community-based organizations such as clubs, neighborhood groups, volunteer associations and small religious institutions manage their daily activities."
Valerius_B,freifunk,Freifunk is part of a global movement for free infrastructure. Our vision is the democratization of media with free networks. Wireless communities implement this idea worldwide.
Özgür Kara,"Department of Biomedical Informatics (BMI), Emory University School of Medicine","We are pushing the boundaries at the intersection of data science, software research and development, and integrative biomedical research to advance healthcare."
Sandeep Saurav,OSGeo - Open Source Geospatial Foundation,OSGeo is a non-profit organization serving as an umbrella organization for the Open Source Geospatial community.
Azamat Akimniyazov,Apertium,A free/open-source machine translation platform.
Jianhui Lu,PostgreSQL,"PostgreSQL is a powerful, open source object-relational database system."
Ankit kumar,OpenMRS,The OpenMRS community globally works together to build the world's leading open-source enterprise electronic medical record system platform.
fibersel,The Apache Software Foundation,Providing open source software to the public free of charge
Rushikesh Tote,Casbin,"Authorization library that supports access control models like ACL, RBAC, ABAC"
Aaron Saw Min Sern,OSGeo - Open Source Geospatial Foundation,OSGeo is a non-profit organization serving as an umbrella organization for the Open Source Geospatial community.
Jaikishan Brijwani,Sugar Labs,"We make tools that learners use to explore, discover, create, and
reflect. We encourage our users to appropriate them, taking ownership
and responsibility for their learning."
AYAN BISWAS,CircuitVerse.org,"CircuitVerse is an easy to use digital logic circuit simulator which aims at providing a platform to interactively create, share and learn digital circuits."
Soumya,Blender Foundation,"Blender is the free/open source 3D creation software for everyone, providing individuals and small teams a complete pipeline for 3D graphics, modeling, animation and games."
Pratyush Das,The LLVM Compiler Infrastructure,The LLVM Project is a collection of modular and reusable compiler and toolchain technologies.
Harsh Khilawala,INCF,"INCF enables open and FAIR neuroscience by developing and endorsing standards and best practices, and by providing training in neuroinformatics and data management."
Piyumal Demotte,INCF,"INCF enables open and FAIR neuroscience by developing and endorsing standards and best practices, and by providing training in neuroinformatics and data management."
Santhosh Anguluri,KDE Community,"The KDE community produces Free and Open Source Software and brings together artists, designers, programmers, translators, users, writers and other contributors from everywhere"
Rishabh Garg,mlpack,"mlpack is a fast, flexible machine learning library written in C++."
Daniyal Abbasi,Django Software Foundation,"Django is a high-level Python Web framework originally designed to build high-performing, elegant Web applications quickly."
Ayush Tiwari,AOSSIE,The Australian umbrella organization for open-source projects.
Riccardo Mori,The LLVM Compiler Infrastructure,The LLVM Project is a collection of modular and reusable compiler and toolchain technologies.
Julius Hohnerlein,AFLplusplus,AFL++ - originally based on afl - is currently one of the most efficient fuzzers available and is deployed on Google's oss-fuzz. Join us to make afl++ even better!
Mark Nawar,The R Project for Statistical Computing,"R provides a wide variety of statistical and graphical techniques, and is highly extensible. R is often the tool of choice for research in statistical methodology."
Saahil,Python Software Foundation,"Python is a popular high-level programming language used by scientists, developers, and
many others who want to work more quickly and integrate systems more effectively."
Ashish-Kumar,OSGeo - Open Source Geospatial Foundation,OSGeo is a non-profit organization serving as an umbrella organization for the Open Source Geospatial community.
Suryansh Singh Tomar,AOSSIE,The Australian umbrella organization for open-source projects.
Christos Margiolis,FreeBSD Project,"FreeBSD is an advanced, open source operating system that features a mature network stack, a high degree of reliability, and excellent performance."
Fahad Nayyar,Java PathFinder,"JPF is a highly extensible Java virtual machine written in Java. It is used to create many verification and debugging tools, ranging from model checkers to test case generators."
Sourav singh,OSGeo - Open Source Geospatial Foundation,OSGeo is a non-profit organization serving as an umbrella organization for the Open Source Geospatial community.
Aleksandr Gushchin,Xiph.Org Foundation,"The Xiph.Org Foundation is a non-profit dedicated to developing free, open protocols and software for multimedia on the Internet."
Lucas Stankus,The Linux Foundation,"The Linux Foundation is a non-profit consortium dedicated to fostering the growth of Linux. Hosting the Linux Kernel. OpenPrinting, Linux Standards Base, SPDX, ..."
YADNIK BENDALE,BeagleBoard.org Foundation,"BeagleBoard.org is advancing open source hardware and growing the community of embedded Linux developers. This year, we've added RISC-V hardware."
Srinivas Yadav,STE||AR Group,The STE||AR Group develops tools that simplify writing efficient parallel task-based applications that utilize all of the available compute resources in your machine.
daksh,Cuneiform Digital Library Initiative (CDLI),"CDLI is driven by the mission to enable collection, preservation, and accessibility of information concerning artifacts inscribed the cuneiform script."
Nazerke Turtayeva,Free and Open Source Silicon Foundation,Working together to improve the Free and Open Source Silicon ecosystem
Akhil,PEcAn Project,"Ecosystem science, policy, and management informed by the best data and models"
Kaushik Sivashankar,OWASP Foundation,"The Open Web Application Security Project® (OWASP) is a nonprofit foundation that improves application security through open-source projects, local chapters, and conferences."
Barun,Public Lab,Public Lab is a community and non-profit democratizing science to address environmental issues that affect people.
Vedant Paranjape,libcamera,"An open source camera stack and framework for Linux, Android, and ChromeOS"
Hasan Faraz Khan,Hydra Ecosystem,Automate REST APIs. Build next generation API clients.
Aditya Mulgundkar,OpenCV,"OpenCV, the Open Source Computer Vision Library includes state of the art computer vision and deep learning algorithms. It is professionally coded and optimized."
Abhijeet Bodas,Zulip,"Zulip is a powerful, open source group chat application with a unique threading model.  Zulip has invested extensively in tooling designed to give contributors a great experience."
Oscar Ekholm,GNU Radio,GNU Radio is a free & open-source software development toolkit that provides signal processing blocks to implement software radios.
Lut,Elm Tooling,We're an organization to facilitate work on tooling for Elm
Yash-10,Libre Space Foundation,"Libre Space Foundation is working on several free software, open hardware and open data projects directly and indirectly related to space applications and technologies."
Zohaib Ansari,OpenStreetMap,"OpenStreetMap was started because most maps you think of as free have restrictions on their use, holding back people from using them in creative, productive, or unexpected ways."
Tasneem Koushar,Chromium,"Chromium is an open-source project that aims to provide fast, seamless, safe, and reliable computing experiences for all."
Harshit Sharma,Polypheny,Polypheny is a novel & innovative adaptive database system. It efficiently processes heterogeneous workloads by combining specialized storage engines based on a learned cost model.
Gaelan Steele,QEMU,"QEMU is an emulator and virtualizer that can run x86, ARM, and more virtual machines on a different machine. It has both dynamic binary translation and virtualization capabilities."
Kumar Kartikeya Dwivedi,CRIU,CRIU is a tool that can save the state of a running container to disk and restore the container later exactly as it was
Mostafa Ashraf Mohamed,Android Graphics Tools Team,Providing excellent tools for graphics developers and driver makers
Shravan Chaudhari,Machine Learning for Science (ML4SCI) Umbrella Organization,Umbrella organization for machine learning applications to open problems in science
Pavan Joshi,CircuitVerse.org,"CircuitVerse is an easy to use digital logic circuit simulator which aims at providing a platform to interactively create, share and learn digital circuits."
Mishal Singhai,"Center for Research in Open Source Software, UC Santa Cruz",CROSS bridges the gap between student research and successful open source projects.
Vasanth Mani Vasi,The Julia Language,A fresh approach to Technical Computing
Chandykunju Alex,TensorFlow,TensorFlow is an open-source machine learning framework for everyone.
zyklotomic,Haskell.org,"Haskell is an advanced, purely functional programming language. It boasts a strong type system with type inference. It compiles to fast native code with a concurrent runtime."
Qijia “Joy” Liu,CNCF,Building sustainable ecosystems for cloud native software
Tejasvi Chebrolu,SageMath,"SageMath is a free open-source mathematics software system licensed under the GPL.
It’s mission is “creating a viable free alternative to Magma, Maple, Mathematica and Matlab”."
Can Alpay,National Resource for Network Biology (NRNB),"The National Resource for Network Biology (NRNB) organizes the development of free, open source software to enable network-based visualization, analysis, and biomedical discovery."
Divyank Lunkad,AOSSIE,The Australian umbrella organization for open-source projects.
sh15h4nk,freifunk,Freifunk is part of a global movement for free infrastructure. Our vision is the democratization of media with free networks. Wireless communities implement this idea worldwide.
Omer Yacine,Shaka Player,Shaka Player is an open-source JavaScript library for streaming adaptive media. It plays adaptive media formats (such as DASH and HLS) in a browser.
Sushmita,Public Lab,Public Lab is a community and non-profit democratizing science to address environmental issues that affect people.
Yash Varshney,Wikimedia Foundation,"Wikimedia is a global movement whose mission is to bring free educational content to the world through its various projects, local chapters, and support structures."
Tin Chon Chan,Point Cloud Library,"The Point Cloud Library (PCL) is a standalone, large scale, open project for 2D/3D image and point cloud processing."
Ricardo Subtil,Godot Engine,Godot is a multi-platform 2D and 3D game engine with a feature-rich editor
Dhruv Sondhi,TARDIS SN,TARDIS is a community-developed tool to simulate the spectrum of light emitted by exploding stars using Monte Carlo techniques.
Yunfei Zhao,Red Hen Lab,Research on Multimodal Communication
Trung Ngo Tan,RoboComp,RoboComp is a modern open-source Robotics framework.
Simran Kathpalia,FreeBSD Project,"FreeBSD is an advanced, open source operating system that features a mature network stack, a high degree of reliability, and excellent performance."
Shivam Pathak,Digital Impact Alliance (DIAL) at UN Foundation,"Open source projects for humanitarian work, international development, and peace"
Shardul Semwal,Kodi,The ultimate entertainment center
akash konda,Joplin,"Joplin is an open-source note taking and to-do application with synchronisation capabilities. The notes are searchable, tagged and images or files can be attached to them."
Satyam Kumar,MBDyn,MBDyn is a free general-purpose multibody/multiphysics solver
Martin Schulz,Python Software Foundation,"Python is a popular high-level programming language used by scientists, developers, and
many others who want to work more quickly and integrate systems more effectively."
Anuj Singhal,MIT App Inventor,"MIT App Inventor is a free, open source web app that anyone can use to build mobile apps."
Laurine Dargaud,Pharo Consortium,"Pharo is a pure object-oriented programming language and a powerful environment, focused on simplicity and immediate feedback (think IDE and OS rolled into one)."
Antriksh Misri,Python Software Foundation,"Python is a popular high-level programming language used by scientists, developers, and
many others who want to work more quickly and integrate systems more effectively."
sayandip18,Python Software Foundation,"Python is a popular high-level programming language used by scientists, developers, and
many others who want to work more quickly and integrate systems more effectively."
Ashish Patel,Project WikiLoop,WikiLoop is an umbrella for a series of projects contributing to open knowledge at scale. Tibetan Initiative branch focuses on preserving precious knowledge of human civilization.
Anuj Lamoria,CHAOSS Project,CHAOSS is an open source project focused on creating analytics and metrics to help define community health. The CHAOSS Project community is organized around software and metrics.
Junxuan Wu,The Apache Software Foundation,Providing open source software to the public free of charge
Niklas Schmitz,The Julia Language,A fresh approach to Technical Computing
Dimitris Papageorgiou,NumFOCUS,"NumFOCUS supports and promotes world-class, innovative, open source scientific software."
EXTREMOPHILARUM,OWASP Foundation,"The Open Web Application Security Project® (OWASP) is a nonprofit foundation that improves application security through open-source projects, local chapters, and conferences."
Hae Dong Lee,The Apache Software Foundation,Providing open source software to the public free of charge
srikavin,strace,"strace is a diagnostic, debugging and instructional userspace utility for Linux. It is used to monitor and tamper with interactions between processes and the Linux kernel."
Isala Piyarisi,openSUSE Project,"The openSUSE project is a community effort to enhance and promote the use of Linux. openSUSE creates one of the world's best Linux distributions, as well as a variety of tools."
Cian Jinks,Blender Foundation,"Blender is the free/open source 3D creation software for everyone, providing individuals and small teams a complete pipeline for 3D graphics, modeling, animation and games."
Kaaira Gupta,TianoCore,TianoCore is the community supporting an open source implementation of the Unified Extensible Firmware Interface (UEFI). EDK II is our firmware development environment.
Aditya Kurkure,Google FHIR SDK,"The Android FHIR SDK is an Android library for building offline-capable, mobile-first healthcare applications using FHIR resources on Android."
Utkarsh A. Mishra,JdeRobot - Universidad Rey Juan Carlos,"JdeRobot is a software toolkit for development of Robotics and Computer Vision applications. ROS friendly. It uses Python, C++, JS. It includes an Academy to learn robotics"
Sheng-Feng,The Honeynet Project,The Honeynet Project is a non-profit research organization dedicated to improving the security of the Internet at no cost to the public. Focus is on honeypots and threat analysis.
Nippun Sharma,mlpack,"mlpack is a fast, flexible machine learning library written in C++."
